{
  "specVersion": "0.2.0",
  "source": {
    "id": "olyasuharska-vemos-una-pelicula",
    "filename": "Vemos_una_peli_cula__olyasuharska.mp4",
    "durationMs": 176376,
    "fps": 24,
    "width": 720,
    "height": 1280,
    "codec": "h264"
  },
  "meta": {
    "analyzedAt": "2026-06-12",
    "analyzerVersion": "0.3.0-sandbox",
    "samplingFps": 6,
    "microWindowsFps": 24,
    "notes": "Flow muestreado cada 4 frames; ventanas densas a 24fps en 2 animaciones; captions/overlays muestreados (no exhaustivos), leídos por visión.",
    "shotDetection": "AdaptiveDetector (hard cuts) + dissolve detector (long-baseline hist + edge collapse) + flash labeler"
  },
  "shots": [
    {
      "id": "shot_001",
      "startMs": 0,
      "endMs": 1458,
      "durationMs": 1458,
      "transitionIn": {
        "type": "open"
      },
      "camera": {
        "type": "static",
        "magnitude": 0.022,
        "confidence": 0.79
      },
      "object": {
        "activity": "low",
        "outlierRatio": 0.21
      }
    },
    {
      "id": "shot_002",
      "startMs": 1458,
      "endMs": 4417,
      "durationMs": 2958,
      "transitionIn": {
        "type": "cut"
      },
      "camera": {
        "type": "static",
        "magnitude": 0.004,
        "confidence": 0.74
      },
      "object": {
        "activity": "medium",
        "outlierRatio": 0.26
      }
    },
    {
      "id": "shot_003",
      "startMs": 4417,
      "endMs": 5833,
      "durationMs": 1417,
      "transitionIn": {
        "type": "cut"
      },
      "camera": {
        "type": "punch_in",
        "magnitude": 0.12,
        "confidence": 0.64
      },
      "object": {
        "activity": "high",
        "outlierRatio": 0.36
      }
    },
    {
      "id": "shot_004",
      "startMs": 5833,
      "endMs": 7625,
      "durationMs": 1792,
      "transitionIn": {
        "type": "cut"
      },
      "camera": {
        "type": "punch_in",
        "magnitude": 0.1,
        "confidence": 0.44
      },
      "object": {
        "activity": "high",
        "outlierRatio": 0.56
      }
    },
    {
      "id": "shot_005",
      "startMs": 7625,
      "endMs": 9208,
      "durationMs": 1583,
      "transitionIn": {
        "type": "cut"
      },
      "camera": {
        "type": "drift_subtle",
        "magnitude": 0.045,
        "confidence": 0.9
      },
      "object": {
        "activity": "low",
        "outlierRatio": 0.02
      }
    },
    {
      "id": "shot_006",
      "startMs": 9208,
      "endMs": 10875,
      "durationMs": 1667,
      "transitionIn": {
        "type": "cut"
      },
      "camera": {
        "type": "zoom_out",
        "magnitude": 0.45,
        "confidence": 0.9
      },
      "object": {
        "activity": "low",
        "outlierRatio": 0.0
      }
    },
    {
      "id": "shot_007",
      "startMs": 10875,
      "endMs": 12875,
      "durationMs": 2000,
      "transitionIn": {
        "type": "cut"
      },
      "camera": {
        "type": "static",
        "magnitude": 0.131,
        "confidence": 0.9
      },
      "object": {
        "activity": "low",
        "outlierRatio": 0.01
      }
    },
    {
      "id": "shot_008",
      "startMs": 12875,
      "endMs": 14583,
      "durationMs": 1708,
      "transitionIn": {
        "type": "cut"
      },
      "camera": {
        "type": "punch_in",
        "magnitude": 2.71,
        "confidence": 0.75
      },
      "object": {
        "activity": "medium",
        "outlierRatio": 0.25
      }
    },
    {
      "id": "shot_009",
      "startMs": 14583,
      "endMs": 21458,
      "durationMs": 6875,
      "transitionIn": {
        "type": "cut"
      },
      "camera": {
        "type": "punch_in",
        "magnitude": 0.643,
        "confidence": 0.7
      },
      "object": {
        "activity": "medium",
        "outlierRatio": 0.3
      }
    },
    {
      "id": "shot_010",
      "startMs": 21458,
      "endMs": 25708,
      "durationMs": 4250,
      "transitionIn": {
        "type": "dissolve"
      },
      "camera": {
        "type": "static",
        "magnitude": 0.67,
        "confidence": 0.85
      },
      "object": {
        "activity": "low",
        "outlierRatio": 0.15
      }
    },
    {
      "id": "shot_011",
      "startMs": 25708,
      "endMs": 26792,
      "durationMs": 1083,
      "transitionIn": {
        "type": "cut"
      },
      "camera": {
        "type": "punch_in",
        "magnitude": 0.353,
        "confidence": 0.9
      },
      "object": {
        "activity": "low",
        "outlierRatio": 0.08
      }
    },
    {
      "id": "shot_012",
      "startMs": 26792,
      "endMs": 28542,
      "durationMs": 1750,
      "transitionIn": {
        "type": "cut"
      },
      "camera": {
        "type": "static",
        "magnitude": 0.013,
        "confidence": 0.76
      },
      "object": {
        "activity": "medium",
        "outlierRatio": 0.24
      }
    },
    {
      "id": "shot_013",
      "startMs": 28542,
      "endMs": 30583,
      "durationMs": 2042,
      "transitionIn": {
        "type": "cut"
      },
      "camera": {
        "type": "pan",
        "magnitude": 0.067,
        "confidence": 0.72
      },
      "object": {
        "activity": "medium",
        "outlierRatio": 0.28
      }
    },
    {
      "id": "shot_014",
      "startMs": 30583,
      "endMs": 34875,
      "durationMs": 4292,
      "transitionIn": {
        "type": "flash_cut"
      },
      "camera": {
        "type": "pan",
        "magnitude": 0.491,
        "confidence": 0.75
      },
      "object": {
        "activity": "medium",
        "outlierRatio": 0.25
      }
    },
    {
      "id": "shot_015",
      "startMs": 34875,
      "endMs": 38292,
      "durationMs": 3417,
      "transitionIn": {
        "type": "cut"
      },
      "camera": {
        "type": "punch_in",
        "magnitude": 0.195,
        "confidence": 0.79
      },
      "object": {
        "activity": "low",
        "outlierRatio": 0.21
      }
    },
    {
      "id": "shot_016",
      "startMs": 38292,
      "endMs": 38875,
      "durationMs": 583,
      "transitionIn": {
        "type": "flash_cut"
      },
      "camera": {
        "type": "unknown",
        "confidence": 0.2
      },
      "object": {
        "activity": "unknown"
      }
    },
    {
      "id": "shot_017",
      "startMs": 38875,
      "endMs": 39625,
      "durationMs": 750,
      "transitionIn": {
        "type": "cut"
      },
      "camera": {
        "type": "pan",
        "magnitude": 0.068,
        "confidence": 0.49
      },
      "object": {
        "activity": "high",
        "outlierRatio": 0.51
      }
    },
    {
      "id": "shot_018",
      "startMs": 39625,
      "endMs": 44750,
      "durationMs": 5125,
      "transitionIn": {
        "type": "cut"
      },
      "camera": {
        "type": "punch_in",
        "magnitude": 0.432,
        "confidence": 0.62
      },
      "object": {
        "activity": "high",
        "outlierRatio": 0.38
      }
    },
    {
      "id": "shot_019",
      "startMs": 44750,
      "endMs": 50333,
      "durationMs": 5583,
      "transitionIn": {
        "type": "cut"
      },
      "camera": {
        "type": "punch_in",
        "magnitude": 0.279,
        "confidence": 0.9
      },
      "object": {
        "activity": "low",
        "outlierRatio": 0.1
      }
    },
    {
      "id": "shot_020",
      "startMs": 50333,
      "endMs": 54333,
      "durationMs": 4000,
      "transitionIn": {
        "type": "flash_cut"
      },
      "camera": {
        "type": "zoom_out",
        "magnitude": 0.567,
        "confidence": 0.9
      },
      "object": {
        "activity": "low",
        "outlierRatio": 0.01
      }
    },
    {
      "id": "shot_021",
      "startMs": 54333,
      "endMs": 56333,
      "durationMs": 2000,
      "transitionIn": {
        "type": "cut"
      },
      "camera": {
        "type": "zoom_out",
        "magnitude": 0.109,
        "confidence": 0.9
      },
      "object": {
        "activity": "low",
        "outlierRatio": 0.02
      }
    },
    {
      "id": "shot_022",
      "startMs": 56333,
      "endMs": 57917,
      "durationMs": 1583,
      "transitionIn": {
        "type": "cut"
      },
      "camera": {
        "type": "pan",
        "magnitude": 0.097,
        "confidence": 0.71
      },
      "object": {
        "activity": "medium",
        "outlierRatio": 0.29
      }
    },
    {
      "id": "shot_023",
      "startMs": 57917,
      "endMs": 63208,
      "durationMs": 5292,
      "transitionIn": {
        "type": "flash_cut"
      },
      "camera": {
        "type": "punch_in",
        "magnitude": 0.567,
        "confidence": 0.9
      },
      "object": {
        "activity": "low",
        "outlierRatio": 0.07
      }
    },
    {
      "id": "shot_024",
      "startMs": 63208,
      "endMs": 65042,
      "durationMs": 1833,
      "transitionIn": {
        "type": "cut"
      },
      "camera": {
        "type": "zoom_out",
        "magnitude": 0.803,
        "confidence": 0.9
      },
      "object": {
        "activity": "low",
        "outlierRatio": 0.1
      }
    },
    {
      "id": "shot_025",
      "startMs": 65042,
      "endMs": 70667,
      "durationMs": 5625,
      "transitionIn": {
        "type": "cut"
      },
      "camera": {
        "type": "punch_in",
        "magnitude": 0.271,
        "confidence": 0.74
      },
      "object": {
        "activity": "medium",
        "outlierRatio": 0.26
      }
    },
    {
      "id": "shot_026",
      "startMs": 70667,
      "endMs": 71917,
      "durationMs": 1250,
      "transitionIn": {
        "type": "cut"
      },
      "camera": {
        "type": "drift_subtle",
        "magnitude": 0.084,
        "confidence": 0.52
      },
      "object": {
        "activity": "high",
        "outlierRatio": 0.48
      }
    },
    {
      "id": "shot_027",
      "startMs": 71917,
      "endMs": 72750,
      "durationMs": 833,